response_id;user_id;group_id;longitudinal_id;run;phase;started;finished;"Trust_1";"Trust_2";"Understanding_1";"Understanding_2";"Understanding_3";"Understanding_4";"MentalLoad_1";"PerceivedSafety_1";"PerceivedSafety_2";"PerceivedSafety_3";"PerceivedSafety_4";"Aesthetics_1";"Acceptance_1";"AttentionCheck_1";"Acceptance_2";"TextInput_1"
3;"62FC25EF4CE0D3D169B7A120";"GroupE";"GroupE_BO";1;"exploration";09/04/2023 00:16:07;09/04/2023 00:18:06;5;5;5;5;5;5;1;3;3;3;3;6;6;;6;"I felt safe in the vehicle. At first the choppy way it turns was a bit concerning but this obviously is just part of the program and not something I should pay attention to!"
4;"62FC25EF4CE0D3D169B7A120";"GroupE";"GroupE_BO";2;"exploitation";09/04/2023 00:19:13;09/04/2023 00:20:43;3;4;1;3;3;3;5;-1;1;1;0;3;2;;2;"I did not like that there wasn't much information displayed for me to see and that it wasn't showing me that it detected other things besides the people walking and their intentions. "
5;"62FC25EF4CE0D3D169B7A120";"GroupE";"GroupE_BO";3;"exploitation";09/04/2023 00:21:31;09/04/2023 00:23:13;5;5;5;5;5;5;1;3;3;3;3;7;7;1;7;"I really liked that all of the information was displayed for me to see, it made me feel safe and able to trust the vehicle much more. "
6;"62FC25EF4CE0D3D169B7A120";"GroupE";"GroupE_BO";1;"";09/04/2023 00:26:47;09/04/2023 00:29:38;3;4;3;4;3;3;10;0;1;1;0;6;5;;5;"It appeared to run a stop sign at one point. I do not like that it doesn't show use of turn signals. I didn't understand why it was stopping at some places, one of them appeared to be at a stoplight but I couldn't really tell. All in all, that info could be useful, turn signal use and stop light and stop sign info. "
8;"62FC25EF4CE0D3D169B7A120";"GroupE";"GroupE_BO";2;"";09/05/2023 00:52:36;09/05/2023 00:53:54;5;5;5;5;5;5;1;3;3;3;3;7;7;;7;"The only problem  I can think of is the car did not stop at a stop sign towards the end of the trip. "
10;"62FC25EF4CE0D3D169B7A120";"GroupE";"GroupE_BO";3;"";09/06/2023 06:01:41;09/06/2023 06:03:06;5;5;5;5;1;5;1;3;3;3;3;7;7;;7;"Again, the vehicle didn't seem to stop at a stop sign toward the end. Other than that there were no problems."
